,pro_link,title,status,percentage_fund,funded,target,end_date,backers,subcategory,thumbnail_type,number_rewards,min_price,max_price,num_news,num_comments,num_contributions,creater_link,language,short_des
224,https://www.kisskissbankbank.com/en/projects/green-grass-webserie--2,Green Grass (Webserie),Failed,13,255.0,2000.0,2013-02-13,15,,jpg,11,1.0,300.0,1,9,15,https://www.kisskissbankbank.com/en/users/watelss-production,fr,"donnez, coup, pouce, soutenant, financièrement, web-série., douanier, pleine, crise, quarantaine, décide, nettoyer, campagne, trafiquants, cocktail, étonnant, d'humour, d'action, produite, l'association, watelss, production, l'association, hurlement., cette, série, reflète, an, préparation, d'écriture., l'ensemble, équipe, constitué, bénévoles, (amateurs, professionnels),, fonds, demandés, cette, page, serviront, post-production, première, saison, préparation, prochaine..."
225,https://www.kisskissbankbank.com/en/projects/nouveau-clip-panne-de-courant-piscine-noire,"Nouveau clip ""Panne de Courant/Piscine Noire""",Failed,20,995.0,5000.0,2012-12-09,23,,jpeg,8,1.0,1000.0,1,5,23,https://www.kisskissbankbank.com/en/users/orties,fr,"allons, auto-produire, nouveau, clip, vidéo, ""panne, courant/piscine, noire"",, virée, angoissée, l'aristocratie, parisienne,, quelque, part, entre, ""american, psycho"", bret, easton, ellis, ""enter, the, void"", gaspar, noé., aidez-nous, réaliser, projet"
226,https://www.kisskissbankbank.com/en/projects/ngunza-forces-invisibles-du-royaume-kongo,"Ngunza, forces invisibles du royaume Kongo",Failed,8,360.0,4500.0,2013-07-28,9,,jpg,7,15.0,450.0,0,4,9,https://www.kisskissbankbank.com/en/users/hadrien-courtier,fr,"documentaire, l'univers, magico-religieux, guérisseurs, congo-brazzaville"
227,https://www.kisskissbankbank.com/en/projects/graveur-a-main,graveur à main,Failed,20,510.0,2500.0,2018-05-01,4,,JPG,9,5.0,1000.0,1,4,4,https://www.kisskissbankbank.com/en/users/indice51-coin-ring,fr,"financer, métier, d'art,, gravure, main, qu'elle, perdure, aider, agrandir, petite, entreprise"
228,https://www.kisskissbankbank.com/en/projects/second-chance-c-magnien-feature-film,SECOND CHANCE / C.Magnien / Feature Film,Failed,4,140.0,3500.0,2013-05-01,5,,jpg,5,10.0,100.0,0,0,5,https://www.kisskissbankbank.com/en/users/leopardman,en,"two, parallel, stories, happening, greece, 2008, 2015,, 1st, crisscross, clash, others, brutal, unexpected, climax!"
229,https://www.kisskissbankbank.com/en/projects/1001-ventres/tabs/description,1001 ventres | ألف بطن و بطن,Successful,107,5395.0,5000.0,2017-05-26,70,,jpg,9,5.0,500.0,0,7,70,https://www.kisskissbankbank.com/en/users/1001ventres,en,"help, 1001, ventres,, collective, project, initiated, tamara, saade,, residency, presentation, work, progress, tripoli,, lebanon."
230,https://www.kisskissbankbank.com/en/projects/film-en-esperanto-la-magia-lando-filmo-en-esperanto,Film en espéranto - La Magia Lando -  Filmo en esperanto,Failed,34,1030.0,3000.0,2018-03-01,7,,jpg,4,20.0,300.0,0,0,7,https://www.kisskissbankbank.com/en/users/esperanto-lausanne,es,"cinéma:, bon, moyen, soutenir, diffusion, l'espéranto., filmo:, bona, rimedo, por, subteni, disvastigon, esperanto."
231,https://www.kisskissbankbank.com/en/projects/the-todiefold,The Todiefold,Failed,1,10.0,2000.0,2018-07-14,1,,png,7,10.0,150.0,0,0,1,https://www.kisskissbankbank.com/en/users/cristian-todie,en,"help, us, finance, todiéfold,, innovative, experience, maximum, complexity, delight, brain, paper,, math,, geometry, lovers."
232,https://www.kisskissbankbank.com/en/projects/visual-culture-a-tool-for-design-collaboration-with-git,VISUAL CULTURE a tool for design collaboration (with GIT),Failed,4,471.0,12500.0,2014-12-02,16,,gif,8,10.0,1000.0,0,2,16,https://www.kisskissbankbank.com/en/users/osp--3,en,"visualise, evolution, design, projects,, facilitate, collaborations,, harness, power, git!"
233,https://www.kisskissbankbank.com/en/projects/sexy-pause-arret-sur-image,Sexy Pause - Arrêt sur image,Failed,0,0.0,3550.0,2014-03-30,0,,jpg,8,5.0,1000.0,3,0,0,https://www.kisskissbankbank.com/en/users/sexypause,fr,"chic, d'une, galerie, porn'art, mêlant, photographie,, court-métrage, littérature., piquante, liaison, entre, sensualité,, érotisme, sexualité."
234,https://www.kisskissbankbank.com/en/projects/the-bee-universal-urban-tricycle,The BEE - universal urban tricycle,Failed,1,130.0,8100.0,2015-06-23,2,,jpg,6,10.0,3800.0,0,1,2,https://www.kisskissbankbank.com/en/users/trytrike,en,"help, us, create, healthier, alternative, city, transport., bee, utility, fun, every, weather, year, long,, benefits, everyone!"
235,https://www.kisskissbankbank.com/en/projects/made-in-love,MADE IN LOVE,Failed,52,7870.0,15000.0,2015-12-21,97,,gif,13,5.0,50000.0,7,29,97,https://www.kisskissbankbank.com/en/users/made-in-love-team,en,"condom, transform, piece, art, ..., condom,, real, intimate, asset,, erotic, ephemeral, tattoo, .."
236,https://www.kisskissbankbank.com/en/projects/pidan-studio-gamelle-dietetique-pour-chat,PIDAN STUDIO - Gamelle Diététique Pour Chat,Failed,32,642.0,2000.0,2017-07-30,18,,jpg,7,5.0,42.0,1,1,18,https://www.kisskissbankbank.com/en/users/pidan-studio,en,"feed, cat, dietary, way,, start, choosing, right, bowl."
237,https://www.kisskissbankbank.com/en/projects/arakwar,Arakwar,Failed,0,1.0,4400.0,2015-07-12,1,,png,7,1.0,100.0,0,0,1,https://www.kisskissbankbank.com/en/users/cust,en,"galaxy, threatened,, needs, kissbankers!, help."
