,pro_link,title,status,percentage_fund,funded,target,end_date,backers,subcategory,thumbnail_type,number_rewards,min_price,max_price,num_news,num_comments,num_contributions,creater_link,language,short_des
68,https://www.kisskissbankbank.com/en/projects/caboulot-courbevoie-vins-nature-et-produits-du-terroir-eco-responsables,Caboulot Courbevoie : vins nature et produits du terroir éco-responsables,Successful,165,"€4,137","Out of €2,500",12/11/2020,51,"Zero waste,Organic,French manufacturing",png,12,9.0,300.0,6,11,54,https://www.kisskissbankbank.com/en/users/arnaud-morisse,fr,"Soutenez Caboulot, et on vous le rendra au centuple de plaisirs (à base de vins naturels et produits gourmands d'exception!)"
69,https://www.kisskissbankbank.com/en/projects/los-hermanos-pouye-premier-album,"Los Hermanos Pouyé, Premier album.",Successful,167,"€3,337","Out of €2,000",12/11/2020,102,Indie,jpg,7,8.0,300.0,0,29,104,https://www.kisskissbankbank.com/en/users/gaspar-pouye,en,Help us to record our first album !
70,https://www.kisskissbankbank.com/en/projects/way-le-voyage-de-demain,WAY - Le voyage de demain,Successful,101,"€6,085","Out of €6,000",12/11/2020,115,"Indie,Education,Change your life",jpg,10,10.0,500.0,0,35,125,https://www.kisskissbankbank.com/en/users/antoine-payot-2,fr,Consommer le voyage autrement
71,https://www.kisskissbankbank.com/en/projects/nouvel-ep-de-margaux-simone,Nouvel EP de Margaux Simone,Successful,102,"€5,089","Out of €5,000",12/11/2020,61,Indie,jpg,10,5.0,1000.0,0,14,62,https://www.kisskissbankbank.com/en/users/margauxsimone,fr,Soutenez le nouvel EP de Margaux Simone sur KissKissBankBank !
72,https://www.kisskissbankbank.com/en/projects/noel-sauvez-des-livres,Braderie de Noël Rouquemoute 🎁,Successful,1490,745 pre-orders,Out of 50,12/10/2020,74,"Local Development,Indie,French manufacturing",jpg,4,4.0,50.0,2,7,76,https://www.kisskissbankbank.com/en/users/editions-rouquemoute,fr,"Pour Noël, devenez un super-héros Rouquemoute en sauvant des livres avec nos lots de BD adulte et jeunesse à prix cassés ! "
73,https://www.kisskissbankbank.com/en/projects/unboutdumonde,✅ 104% • Entrez dans le monde !,Successful,104,"€155,821","Out of €150,000",12/10/2020,"2,170",Independent media,jpg,14,5.0,500.0,7,98,2196,https://www.kisskissbankbank.com/en/users/julia-cage,fr,"Pour une reconquête citoyenne des médias.
L'indépendance de la presse est l'affaire de tous, rejoignez Un Bout du Monde !"
74,https://www.kisskissbankbank.com/en/projects/les-bords-reels,Les Bords réels,Successful,112,"€8,923","Out of €8,000",12/10/2020,112,"French manufacturing,Independent media",jpg,8,38.0,500.0,1,11,116,https://www.kisskissbankbank.com/en/users/adrien-selbert-16d71cd5-d78e-42f6-890a-f5c9f8cffd1e,en,"Pre-purchase Adrien Selbert's new book, to be published by Le Bec en l'air."
75,https://www.kisskissbankbank.com/en/projects/arnasa-portrait-olfactif-du-pays-basque,"Arnasa, portrait olfactif du Pays Basque",Successful,102,"€3,060","Out of €3,000",12/10/2020,45,"Local Development,French manufacturing",jpg,8,12.0,225.0,0,11,49,https://www.kisskissbankbank.com/en/users/floriane-coum,fr,Soutenez le premier guide sur l'imaginaire olfactif !
76,https://www.kisskissbankbank.com/en/projects/romain-joubert,"JOUBe, un projet de musique électro à vélo",Successful,100,"€6,000","Out of €6,000",12/10/2020,86,"Local Development,Indie,Change your life",png,11,10.0,1000.0,2,21,91,https://www.kisskissbankbank.com/en/users/romain-joubert-984c183f-3c43-49e2-8a71-31a4ffe6385c,fr,"Un vélo préparé, des bons mollets, un live chaloupé. Voici la recette.
"
77,https://www.kisskissbankbank.com/en/projects/processmed-2021-retour-au-liban,Process Liban 2021,Successful,177,"€7,076","Out of €4,000",12/09/2020,164,"Local Development,International solidarity,Fair Trade",png,6,5.0,200.0,2,25,168,https://www.kisskissbankbank.com/en/users/process-mediterranee,fr,Soutenir les initiatives qui luttent contre la précarité alimentaire au Liban !
78,https://www.kisskissbankbank.com/en/projects/urban-faces,URBAN FACES,Successful,105,"€6,766","Out of €6,435",12/09/2020,92,"LGBTQ+,Indie,French manufacturing",jpeg,5,20.0,150.0,0,32,103,https://www.kisskissbankbank.com/en/users/jym-maulin,fr,"URBAN FACES 
Photographies by JYM FACTORY
Livre 152 pages.
Un point de rencontres entre visages, silhouettes, rues et villes.

"
79,https://www.kisskissbankbank.com/en/projects/la-maison-des-canuts,Sauvons la Maison des Canuts,Successful,160,"€80,090","Out of €50,000",12/08/2020,926,"Local Development,French manufacturing,Education",jpg,15,10.0,1000.0,4,145,942,https://www.kisskissbankbank.com/en/users/gigie--4,fr,"La Maison des Canuts, un joyau du patrimoine historique et culturel lyonnais qui pourrait disparaître !"
80,https://www.kisskissbankbank.com/en/projects/revus-et-corriges,"REVUS & CORRIGÉS : films classiques, regards modernes",Successful,130,326 pre-orders,Out of 250,12/08/2020,322,"Indie,French manufacturing,Independent media",png,8,42.0,500.0,6,33,325,https://www.kisskissbankbank.com/en/users/eugenie-filho-74b76f65-b2f2-492c-879e-987798e7bf06,fr,"Soutenez Revus & Corrigés et abonnez-vous !
"
81,https://www.kisskissbankbank.com/en/projects/table-boulangerie-engagee,"Cassava, table & boulangerie artisanale engagée",Successful,106,"€4,225","Out of €4,000",01/12/2021,42,"Organic,Locavore,Local Development",png,8,10.0,400.0,1,16,46,https://www.kisskissbankbank.com/en/users/valerie-lucas-399ca103-b417-455e-aa2f-a510af01e378,fr,Participez à la naissance de Cassava à la Réunion! Le mariage d'une boulangerie artisanale au levain et d'une table éco-responsable
82,https://www.kisskissbankbank.com/en/projects/ibiza-horse-valley,IBIZA HORSE VALLEY,Successful,104,"€20,880","Out of €20,000",01/12/2021,175,Animal Welfare,png,4,10.0,500.0,6,71,190,https://www.kisskissbankbank.com/en/users/jean-patrick-capdevielle,fr,"Sauvons ensemble ""Ibiza Horse Valley"", le sanctuaire des chevaux libres"
83,https://www.kisskissbankbank.com/en/projects/ob2,ENREGISTREMENT DE L'ALBUM OB2 GREGORY OTT ET VINCENT BIDAL,Successful,108,"€10,750","Out of €10,000",01/12/2021,211,Indie,jpg,7,10.0,500.0,0,53,222,https://www.kisskissbankbank.com/en/users/vincent-bidal,hr,Soutenez le projet sur KissKissBankBank !
84,https://www.kisskissbankbank.com/en/projects/playschool-l-album-la-garderie,Playschool l'album : LA GARDERIE,Successful,120,"€3,595","Out of €3,000",01/12/2021,95,Indie,jpg,7,10.0,1000.0,4,22,98,https://www.kisskissbankbank.com/en/users/emmanuel-olsson,fr,"Collectif d’artistes, Playschool a besoin de vous pour financer la sortie de l'album ""La garderie"" et produire un beau clip."
85,https://www.kisskissbankbank.com/en/projects/sick16,S!CK soutient l'indépendance avec le double-numéro Gremlins,Successful,876,876 pre-orders,Out of 100,01/12/2021,312,"French manufacturing,Independent media",gif,12,14.0,225.0,10,41,325,https://www.kisskissbankbank.com/en/users/yoan-villars,fr,"164 pages, 2 couvertures et 0 publicité !"
86,https://www.kisskissbankbank.com/en/projects/teaserlappat,"TEASER Long-métrage ""L'APPÂT""",Successful,169,"€3,642","Out of €2,160",01/11/2021,62,"Anti racism,International solidarity,Independent media",jpg,5,5.0,80.0,0,11,64,https://www.kisskissbankbank.com/en/users/teaser-appat,en,"SOUTENEZ LE TOURNAGE DU TEASER DU LONG-MÉTRAGE ""L'APPÂT""."
87,https://www.kisskissbankbank.com/en/projects/en-immersion-engagee,En immersion Engagée,Successful,682,"€13,639","Out of €2,000",01/10/2021,72,"Local Development,Indie,French manufacturing",png,7,20.0,500.0,1,14,74,https://www.kisskissbankbank.com/en/users/loic-sanchez,fr,"Pré-réservez aujourd’hui votre prochaine micro-immersion en terre méconnue, aidez immédiatement un habitant."
88,https://www.kisskissbankbank.com/en/projects/route-64-le-magazine-du-jeu-d-echecs-hors-des-cases,"Route 64, la revue francophone du jeu d'échecs pour aller hors des cases",Successful,203,406 pre-orders,Out of 200,01/10/2021,172,Independent media,jpg,7,25.0,5000.0,26,34,177,https://www.kisskissbankbank.com/en/users/fabrice-hodecent,fr,"Soutenez la création de Route 64, le nouveau média francophone (128 pages) du jeu d'échecs qui veut voyager hors des cases !"
89,https://www.kisskissbankbank.com/en/projects/caremitou,"Caremitou®, maison de santé connectée qui prend soin de mon chat de chez moi !",Successful,108,27 pre-orders,Out of 25,01/10/2021,16,"Animal Welfare,Recycling,French manufacturing",gif,8,5.0,710.0,1,2,19,https://www.kisskissbankbank.com/en/users/philippe-daurenjou-4abc64ff-11d0-41d3-9bba-5a962260608e,fr,"Un bac à litière connecté, esthétique et performant qui dépiste très tôt et à mon domicile les risques de maladies de mon animal. 

"
